{
  "artifact_type": "commodity_completion_program",
  "as_of": "2026-07-31",
  "control_question": "Which public claim, codebase, device, standard, testbed, or fabrication route can close a system seam now, and what receipt keeps it replaceable?",
  "coverage": {
    "all_registry_records_covered": true,
    "control_question": "Which lane converts each public mechanism into the next closed artifact without waiting for the originating actor to complete the system?",
    "lane_count": 12,
    "record_count": 73
  },
  "doctrine": {
    "admission_rule": "A lane may consume a commodity only through a pinned identity, a named system gap, an explicit first transaction, and a receipt that preserves replacement.",
    "dependency_mode": "commodity_only",
    "exit_rule": "A lane remains valid when any actor or implementation can be removed without changing workload identity, accepted output, fallback behavior, or historical evidence.",
    "statement": "The program decomposes the public frontier into concurrent completion lanes. External actors supply interchangeable artifacts, and the programme retains authority over accepted work, fallback, receipts, and succession."
  },
  "lanes": [
    {
      "control_question": "Which claimed physical advantage survives the identical accepted workload, fallback, and complete system boundary?",
      "first_transaction": "Execute one fixed probabilistic or reversible workload through every available software baseline and emit the physical recovery or sampling conditions required for parity.",
      "gap_ids": [
        "accepted_result",
        "workload_identity",
        "determinism_entropy",
        "model_hardware_fidelity",
        "full_system_energy",
        "harvested_recovered_energy",
        "timing_thermal_volume"
      ],
      "lane_id": "reversible-and-thermodynamic-semantics",
      "mission": "Turn reversible, adiabatic, stochastic, and probabilistic mechanisms into workload-bound strategy and break-even evidence without allowing a device claim to define the workload.",
      "record_ids": [
        "vaire-arc-evp",
        "normal-thermox",
        "normal-cn101-carnot",
        "extropic-thrml",
        "extropic-xtr0-z1",
        "purdue-pbits",
        "oscillator-ising-machines",
        "intel-loihi2-hala-point",
        "ibm-aihwkit"
      ],
      "required_receipts": [
        "accepted-work contract",
        "information-erasure frontier",
        "software baseline",
        "physical recovery or stochastic trace",
        "complete-system EVP receipt"
      ]
    },
    {
      "control_question": "Can the same continuous-time model and accepted event result survive every backend-specific discretization and mapping?",
      "first_transaction": "Run one immutable NIR graph and event dataset across two remote systems, one commercial backend, and a software fallback with first-divergence evidence.",
      "gap_ids": [
        "task_encoding",
        "compiler_lowering",
        "precision_conversion",
        "state_reset",
        "time_synchronization",
        "software_fallback",
        "independent_validation"
      ],
      "lane_id": "neuromorphic-interoperability",
      "mission": "Make neuromorphic models, event streams, remote systems, and commercial chips interchangeable behind explicit continuous-time, discretization, mapping, and accepted-output contracts.",
      "record_ids": [
        "neurobench",
        "lava",
        "nengo",
        "intel-loihi2-hala-point",
        "ebrains-brainscales2",
        "ebrains-spinnaker",
        "open-neuromorphic-research-registry",
        "neuromorphic-nir-synfire",
        "synsense-rockpool-xylo",
        "thor-neuromorphic-commons",
        "openspike-open-silicon"
      ],
      "required_receipts": [
        "NIR and event-data identity",
        "backend mapping",
        "state reset",
        "quantization and discretization",
        "held-out accepted output",
        "host-inclusive measurement"
      ]
    },
    {
      "control_question": "What transformation did the physical world perform beyond sensing, and what acquisition and readout work did the complete system pay?",
      "first_transaction": "Qualify one environmental or molecular trajectory against raw input and a pinned digital fallback under the same held-out assay.",
      "gap_ids": [
        "accepted_result",
        "task_encoding",
        "readout_training",
        "calibration_environment",
        "determinism_entropy",
        "full_system_energy",
        "time_synchronization"
      ],
      "lane_id": "physical-world-and-biological-compute",
      "mission": "Admit environmental, embodied, molecular, and reservoir dynamics only when held-out task gain, calibration, readout, and full acquisition cost prove useful computation.",
      "record_ids": [
        "openprc",
        "reservoirpy",
        "nupack-molecular-programming",
        "visual-dsd",
        "crosssim",
        "protean-shepherd-nova",
        "precice-fmi-openmodelica"
      ],
      "required_receipts": [
        "raw-input baseline",
        "digital reservoir or molecular fallback",
        "train-test identity",
        "environment and calibration",
        "readout model",
        "measured nonfallback episodes"
      ]
    },
    {
      "control_question": "Which compiler transformations preserve information effects, accepted output, state custody, and source provenance?",
      "first_transaction": "Lower one reversible region and one physical-cartridge queue kernel through two compiler paths and prove equivalent RISC-V behavior.",
      "gap_ids": [
        "compiler_lowering",
        "host_interface",
        "workload_identity",
        "accepted_result",
        "security_isolation",
        "fabrication_signoff",
        "independent_validation"
      ],
      "lane_id": "riscv-control-and-hardware-compilers",
      "mission": "Use ordinary RISC-V as the portable control and provenance plane while consuming compiler, generator, and verification communities as replaceable implementation machinery.",
      "record_ids": [
        "ahead-high-performance-riscv",
        "chipyard",
        "openasip",
        "src-ace",
        "circt-mlir",
        "siliconcompiler",
        "calyx-hardware-ir",
        "riscv-verification-stack",
        "normal-open-verilog-stack"
      ],
      "required_receipts": [
        "semantic IR",
        "generated RTL",
        "standard RISC-V differential trace",
        "formal properties",
        "source-location provenance",
        "software fallback"
      ]
    },
    {
      "control_question": "Where does the model stop, which physical behavior replaces it, and how is divergence measured?",
      "first_transaction": "Build a coupled electrical, thermal, and physical cartridge model with shared time custody and two independent solver routes.",
      "gap_ids": [
        "model_hardware_fidelity",
        "calibration_environment",
        "precision_conversion",
        "time_synchronization",
        "full_system_energy",
        "timing_thermal_volume",
        "measurement_reproducibility"
      ],
      "lane_id": "mixed-signal-and-multiphysics-models",
      "mission": "Join circuit, compact-device, electromagnetic, thermal, mechanical, and fluid models through pinned interfaces without allowing simulated energy or fidelity to become measured truth.",
      "record_ids": [
        "crosssim",
        "ihp-sg13g2-open-pdk",
        "openfasoc",
        "src-supreme",
        "ngspice-xyce",
        "openvaf-osdi",
        "meep-openems",
        "precice-fmi-openmodelica",
        "gdsfactory-sax-gsim"
      ],
      "required_receipts": [
        "model and solver identity",
        "geometry and boundary conditions",
        "coupling timestep",
        "conversion assumptions",
        "waveform traces",
        "measured replacement evidence"
      ]
    },
    {
      "control_question": "Does useful delivered traffic still win after lasers, SerDes, package, retry, control, and cooling enter the receipt?",
      "first_transaction": "Express one accepted traffic pattern through an electrical baseline and two photonic cartridge models, then fabricate the smallest measurable structure.",
      "gap_ids": [
        "data_movement",
        "precision_conversion",
        "packaging_assembly",
        "full_system_energy",
        "timing_thermal_volume",
        "reliability_endurance",
        "measurement_reproducibility"
      ],
      "lane_id": "photonics-and-data-movement",
      "mission": "Consume photonic fabrics, optical I/O, open photonic PDKs, simulators, foundries, and metrology as competing data-movement cartridges.",
      "record_ids": [
        "lightmatter-passage",
        "ayar-labs-teraphy",
        "oriole-prism",
        "aim-photonics-pdk",
        "gdsfactory-sax-gsim",
        "siepic-tools",
        "cornerstone-open-platform",
        "openebl-photonics"
      ],
      "required_receipts": [
        "traffic contract",
        "laser and electrical boundary",
        "PDK and compact models",
        "package and fiber attach",
        "BER and retry",
        "measured S-parameters",
        "complete transfer energy"
      ]
    },
    {
      "control_question": "Can a die or link implementation be replaced without changing the workload, state, security, or measurement contract?",
      "first_transaction": "Create one substrate-neutral chiplet package model that can switch among UCIe, CXL, and OpenHBI transport profiles.",
      "gap_ids": [
        "host_interface",
        "data_movement",
        "packaging_assembly",
        "scaling_interconnect",
        "security_isolation",
        "full_system_energy",
        "reliability_endurance"
      ],
      "lane_id": "chiplet-and-package-composition",